{
  "$schema": "http://json-schema.org/draft-07/schema#",
  "title": "SFX Sound Definition",
  "description": "Contract for sfx/sounds/<id>/config.json — one file per catalogued sound.",
  "type": "object",
  "required": ["sound", "backend", "tags", "moods", "default_volume", "description"],
  "properties": {
    "sound": {
      "type": "string",
      "pattern": "^[a-z][a-z0-9_]*$",
      "description": "Canonical id. Also controls cue reference: { \"sound\": \"<id>\" }"
    },
    "aliases": {
      "type": "array",
      "items": { "type": "string" },
      "uniqueItems": true,
      "description": "Alternate cue spellings the engine accepts (e.g. \"swoosh\" for whoosh)."
    },
    "backend": {
      "enum": ["sample", "tone"],
      "description": "sample = bundled CC0 asset; tone = Tone.js/WebAudio recipe (sfx/sounds/<id>/recipe.mjs)."
    },
    "recipe": {
      "type": "string",
      "description": "tone backend: design name (implementation is sfx/sounds/<id>/recipe.mjs)."
    },
    "asset": {
      "type": "string",
      "description": "sample backend: path inside sfx/assets/ (subdirectories allowed, e.g. 'pack/games/coin.mp3'; must exist and match manifest.json SHA-256)."
    },
    "source": {
      "type": "string",
      "description": "Provenance of an imported asset: original pack path or URL. Informational only."
    },
    "level": {
      "type": "object",
      "description": "Sample-backend loudness metadata. Omit for the engine's default automatic law ('auto').",
      "properties": {
        "mode": {
          "enum": ["auto", "peak"],
          "default": "auto",
          "description": "auto = render-time loudness matching against the measured voiceover; peak = legacy 0.9 peak normalization."
        },
        "trim_db": {
          "type": "number",
          "minimum": -24.0,
          "maximum": 12.0,
          "default": 0.0,
          "description": "Per-sound offset applied after loudness matching (positive = deliberately hotter)."
        },
        "measured": {
          "type": "object",
          "description": "Informational analysis written by scripts/import_sfx_pack.py (never used for gain math).",
          "properties": {
            "duration_seconds": { "type": "number" },
            "integrated_lufs": { "type": "number" },
            "true_peak_dbfs": { "type": "number" },
            "loudest_400ms_dbfs": { "type": "number" },
            "leading_silence_seconds": { "type": "number" },
            "trailing_silence_seconds": { "type": "number" }
          }
        }
      }
    },
    "tags": {
      "type": "array",
      "items": { "type": "string" },
      "minItems": 1,
      "uniqueItems": true,
      "description": "Auditory category tags: transition, emphasis, impact, ui, organic, riser, glitch, ambient, accent."
    },
    "moods": {
      "type": "array",
      "items": {
        "enum": ["serious", "tense", "calm", "neutral", "playful", "humorous", "upbeat", "glitch"]
      },
      "minItems": 1,
      "uniqueItems": true,
      "description": "Which scene moods this sound fits. 'neutral' fits everything. 'glitch' is a visual-treatment mood reserved for catalog sounds — never a video or scene mood."
    },
    "default_volume": {
      "type": "number",
      "minimum": 0.0,
      "maximum": 1.0,
      "description": "Applied when a cue omits volume."
    },
    "max_tail_seconds": {
      "type": "number",
      "minimum": 0.1,
      "default": 2.0,
      "description": "Generated/dried length of the sound; used for video-end tail handling."
    },
    "params": {
      "type": "object",
      "description": "Optional per-sound parameters. Each value is a param definition.",
      "additionalProperties": { "$ref": "#/definitions/param" }
    },
    "description": {
      "type": "string",
      "description": "One line: what it sounds like + when to use. Written for an LLM that cannot listen."
    }
  },
  "definitions": {
    "param": {
      "type": "object",
      "required": ["type"],
      "properties": {
        "type": { "enum": ["number", "boolean", "string"] },
        "minimum": { "type": "number", "description": "number only" },
        "maximum": { "type": "number", "description": "number only" },
        "default": {},
        "description": { "type": "string" }
      }
    }
  }
}