{
  "sound": "game_pop",
  "aliases": [
    "coin-pop",
    "tiny-game-pop",
    "blip-pop"
  ],
  "backend": "sample",
  "asset": "pack/games/game_pop.mp3",
  "source": "video games/game pop.mp3",
  "tags": [
    "ui",
    "accent"
  ],
  "moods": [
    "playful",
    "humorous",
    "neutral"
  ],
  "default_volume": 0.45,
  "max_tail_seconds": 0.5,
  "params": {},
  "description": "Ultra-short bubbly pop blip \u2014 a counter increments, a coin or point collected on screen.",
  "level": {
    "mode": "auto",
    "trim_db": 0.0,
    "measured": {
      "duration_seconds": 0.092,
      "true_peak_dbfs": -1.6,
      "loudest_400ms_dbfs": -20.8
    }
  }
}
