{
  "sound": "metallic_hit",
  "aliases": [
    "metal-clang",
    "steel-hit",
    "metal-strike"
  ],
  "backend": "sample",
  "asset": "pack/woosh/metallic_hit.mp3",
  "source": "wooshes, risers, and hits/metallic hit.mp4",
  "tags": [
    "impact",
    "accent"
  ],
  "moods": [
    "serious",
    "tense",
    "neutral"
  ],
  "default_volume": 0.42,
  "max_tail_seconds": 2.24,
  "params": {},
  "description": "Ringing metallic clang with a long shimmer \u2014 metal striking metal, an industrial or mechanical impact.",
  "level": {
    "mode": "auto",
    "trim_db": 0.0,
    "measured": {
      "duration_seconds": 2.239,
      "integrated_lufs": -21.1,
      "true_peak_dbfs": -8.0,
      "loudest_400ms_dbfs": -14.8
    }
  }
}
