{
  "sound": "wind_woosh",
  "aliases": [
    "gust-whoosh",
    "wind-swoosh",
    "breeze-transition"
  ],
  "backend": "sample",
  "asset": "pack/woosh/wind_woosh.mp3",
  "source": "wooshes, risers, and hits/wind gust woosh.wav",
  "tags": [
    "transition",
    "organic"
  ],
  "moods": [
    "calm",
    "neutral",
    "serious"
  ],
  "default_volume": 0.32,
  "max_tail_seconds": 3.72,
  "params": {},
  "description": "Long gusting wind swell that rises and fades \u2014 airy scene transitions, outdoor drift, passage of time.",
  "level": {
    "mode": "auto",
    "trim_db": 0.0,
    "measured": {
      "duration_seconds": 3.718,
      "integrated_lufs": -22.1,
      "true_peak_dbfs": -1.4,
      "loudest_400ms_dbfs": -9.8
    }
  }
}
