{
  "sound": "glitch_loop",
  "aliases": [
    "digital-glitch",
    "corruption-loop",
    "datamosh"
  ],
  "backend": "sample",
  "asset": "pack/mechanical/glitch_loop.mp3",
  "source": "mechanical sfx/glitch.mp3",
  "tags": [
    "glitch",
    "ambient"
  ],
  "moods": [
    "glitch",
    "tense",
    "neutral"
  ],
  "default_volume": 0.3,
  "max_tail_seconds": 3.98,
  "params": {},
  "description": "Stuttering digital corruption bed with bitcrushed snaps \u2014 screen tearing, broken data, system failure visuals.",
  "level": {
    "mode": "auto",
    "trim_db": 0.0,
    "measured": {
      "duration_seconds": 3.976,
      "integrated_lufs": -22.2,
      "true_peak_dbfs": -0.9,
      "loudest_400ms_dbfs": -23.0
    }
  }
}
