{
  "sound": "riser_reverb",
  "aliases": [
    "reverb-build",
    "swell-riser",
    "big-build"
  ],
  "backend": "sample",
  "asset": "pack/woosh/riser_reverb.mp3",
  "source": "wooshes, risers, and hits/riser reverb.mp3",
  "tags": [
    "riser",
    "transition"
  ],
  "moods": [
    "tense",
    "serious",
    "neutral"
  ],
  "default_volume": 0.42,
  "max_tail_seconds": 4.0,
  "params": {},
  "description": "Reverb-drenched swell that widens and lifts \u2014 a spacious build into a scene change or emotional peak.",
  "level": {
    "mode": "auto",
    "trim_db": 0.0,
    "measured": {
      "duration_seconds": 4.0,
      "integrated_lufs": -21.3,
      "true_peak_dbfs": -2.1,
      "loudest_400ms_dbfs": -15.5
    }
  }
}
