{
  "sound": "pay_ding",
  "aliases": [
    "apple-pay",
    "payment-ding",
    "transaction-chime"
  ],
  "backend": "sample",
  "asset": "pack/mechanical/pay_ding.mp3",
  "source": "mechanical sfx/apple pay ding.mp3",
  "tags": [
    "ui",
    "emphasis"
  ],
  "moods": [
    "calm",
    "neutral",
    "playful"
  ],
  "default_volume": 0.5,
  "max_tail_seconds": 1.45,
  "params": {},
  "description": "Bright two-note Apple Pay confirm chime \u2014 checkout success, payment accepted, 'transaction complete' beats.",
  "level": {
    "mode": "auto",
    "trim_db": 0.0,
    "measured": {
      "duration_seconds": 1.446,
      "integrated_lufs": -29.1,
      "true_peak_dbfs": -11.9,
      "loudest_400ms_dbfs": -29.1
    }
  }
}
